
title,primaryCategoryId,sourceId,price,isPaid,license,superTypes,overview,description,dataQuality,rows,cols,fileFormat,features,region,country,state,city,currentEncryptionSecret,masterSecret
"Global Climate Data 2024","cmerg4vr9000beje8j29y5lqn","cmerg8f2p000geje8yuznepqz",99.99,true,"CC-BY-4.0","time-series","A comprehensive dataset covering global temperature trends for 2024.","Includes temperature readings from over 10,000 weather stations, along with climate indicators such as rainfall and humidity levels. Suitable for environmental research and data science applications.","High. Validated through multiple automated and manual verification steps.",500000,10,"csv","Daily temperature records,Geolocation metadata for each station,Aggregated monthly summaries","Global","Multiple","N/A","N/A","enc_secret_2024","master_secret_2024"
"Financial Markets Q4 2024","cmerg4vr9000beje8j29y5lqn","cmerg8f2p000geje8yuznepqz",299.99,true,"MIT","Panel","Stock market data from major exchanges worldwide","Complete trading data including prices, volumes, and market indicators from NYSE, NASDAQ, LSE, and other major exchanges. Perfect for algorithmic trading research.","Premium quality with real-time validation",2500000,15,"csv","Stock prices,Trading volumes,Market indicators,Company metadata","North America","United States","New York","New York","enc_fin_2024","master_fin_2024"
"Healthcare Analytics 2024","cmerg4vr9000beje8j29y5lqn","cmerg8f2p000geje8yuznepqz",449.99,true,"Apache-2.0","cross sectional","Patient outcome data and treatment effectiveness","Anonymized patient data covering treatment outcomes, medication effectiveness, and recovery statistics across multiple hospitals.","Medical grade quality assurance",1200000,20,"csv","Patient outcomes,Treatment data,Recovery statistics,Hospital metrics","Global","Multiple","N/A","N/A","enc_health_2024","master_health_2024"
"E-commerce Trends 2024","cmerg4vr9000beje8j29y5lqn","cmerg8f2p000geje8yuznepqz",199.99,true,"CC-BY-SA-4.0","Event  ","Consumer behavior and purchasing patterns","Comprehensive e-commerce data including customer journeys, purchase patterns, and seasonal trends from major online retailers.","High quality with privacy compliance",3000000,12,"csv","Purchase history,Customer journeys,Product categories,Seasonal trends","Global","Multiple","N/A","N/A","enc_ecom_2024","master_ecom_2024"
"Tech Industry Employment","cmerg4vr9000beje8j29y5lqn","cmerg8f2p000geje8yuznepqz",149.99,true,"GPL-3.0","Panel","Job market trends in technology sector","Employment data, salary trends, and skill requirements in the technology industry across different regions and company sizes.","Professional grade validation",800000,18,"csv","Salary data,Job requirements,Skills analysis,Company sizes","North America","United States","California","San Francisco","enc_tech_2024","master_tech_2024"
